src,dst
R-HSA-109581|Apoptosis,R-HSA-109606|Intrinsic Pathway for Apoptosis
R-HSA-109581|Apoptosis,R-HSA-169911|Regulation of Apoptosis
R-HSA-109581|Apoptosis,R-HSA-5357769|Caspase activation via extrinsic apoptotic signalling pathway
R-HSA-109581|Apoptosis,R-HSA-75153|Apoptotic execution phase
R-HSA-109582|Hemostasis,R-HSA-140877|Formation of Fibrin Clot (Clotting Cascade)
R-HSA-109582|Hemostasis,R-HSA-202733|Cell surface interactions at the vascular wall
R-HSA-109582|Hemostasis,R-HSA-418346|Platelet homeostasis
R-HSA-109582|Hemostasis,R-HSA-75205|Dissolution of Fibrin Clot
R-HSA-109582|Hemostasis,R-HSA-75892|Platelet Adhesion to exposed collagen
R-HSA-109582|Hemostasis,"R-HSA-76002|Platelet activation, signaling and aggregation"
R-HSA-109582|Hemostasis,R-HSA-983231|Factors involved in megakaryocyte development and platelet production
R-HSA-109606|Intrinsic Pathway for Apoptosis,R-HSA-114452|Activation of BH3-only proteins
R-HSA-110313|Translesion synthesis by Y family DNA polymerases bypasses lesions on DNA template,R-HSA-110312|Translesion synthesis by REV1
R-HSA-110313|Translesion synthesis by Y family DNA polymerases bypasses lesions on DNA template,R-HSA-110320|Translesion Synthesis by POLH
R-HSA-110313|Translesion synthesis by Y family DNA polymerases bypasses lesions on DNA template,R-HSA-5655862|Translesion synthesis by POLK
R-HSA-110313|Translesion synthesis by Y family DNA polymerases bypasses lesions on DNA template,R-HSA-5656121|Translesion synthesis by POLI
R-HSA-110313|Translesion synthesis by Y family DNA polymerases bypasses lesions on DNA template,R-HSA-5656169|Termination of translesion DNA synthesis
R-HSA-111465|Apoptotic cleavage of cellular proteins,R-HSA-264870|Caspase-mediated cleavage of cytoskeletal proteins
R-HSA-111885|Opioid Signalling,R-HSA-112040|G-protein mediated events
R-HSA-111885|Opioid Signalling,R-HSA-180024|DARPP-32 events
R-HSA-111931|PKA-mediated phosphorylation of CREB,R-HSA-163615|PKA activation
R-HSA-111933|Calmodulin induced events,R-HSA-111931|PKA-mediated phosphorylation of CREB
R-HSA-111996|Ca-dependent events,R-HSA-111997|CaM pathway
R-HSA-111997|CaM pathway,R-HSA-111933|Calmodulin induced events
R-HSA-112040|G-protein mediated events,R-HSA-112043|PLC beta mediated events
R-HSA-112043|PLC beta mediated events,R-HSA-111996|Ca-dependent events
R-HSA-112310|Neurotransmitter release cycle,R-HSA-210500|Glutamate Neurotransmitter Release Cycle
R-HSA-112310|Neurotransmitter release cycle,"R-HSA-888590|GABA synthesis, release, reuptake and degradation"
R-HSA-112314|Neurotransmitter receptors and postsynaptic signal transmission,"R-HSA-399721|Glutamate binding, activation of AMPA receptors and synaptic plasticity"
R-HSA-112314|Neurotransmitter receptors and postsynaptic signal transmission,R-HSA-442755|Activation of NMDA receptors and postsynaptic events
R-HSA-112314|Neurotransmitter receptors and postsynaptic signal transmission,R-HSA-451326|Activation of kainate receptors upon glutamate binding
R-HSA-112314|Neurotransmitter receptors and postsynaptic signal transmission,R-HSA-977443|GABA receptor activation
R-HSA-112315|Transmission across Chemical Synapses,R-HSA-112310|Neurotransmitter release cycle
R-HSA-112315|Transmission across Chemical Synapses,R-HSA-112314|Neurotransmitter receptors and postsynaptic signal transmission
R-HSA-112316|Neuronal System,R-HSA-112315|Transmission across Chemical Synapses
R-HSA-112316|Neuronal System,R-HSA-1296071|Potassium Channels
R-HSA-112316|Neuronal System,R-HSA-6794362|Protein-protein interactions at synapses
R-HSA-112399|IRS-mediated signalling,R-HSA-109704|PI3K Cascade
R-HSA-112409|RAF-independent MAPK1/3 activation,R-HSA-110056|MAPK3 (ERK1) activation
R-HSA-1168372|Downstream signaling events of B Cell Receptor (BCR),R-HSA-1169091|Activation of NF-kappaB in B cells
R-HSA-1169410|Antimicrobial mechanism of IFN-stimulated genes,R-HSA-1169408|ISG15 antiviral mechanism
R-HSA-1169410|Antimicrobial mechanism of IFN-stimulated genes,R-HSA-9833482|PKR-mediated signaling
R-HSA-1169410|Antimicrobial mechanism of IFN-stimulated genes,R-HSA-9953170|GBP-mediated host defense
R-HSA-1226099|Signaling by FGFR in disease,R-HSA-5655253|Signaling by FGFR2 in disease
R-HSA-1226099|Signaling by FGFR in disease,R-HSA-5655302|Signaling by FGFR1 in disease
R-HSA-1226099|Signaling by FGFR in disease,R-HSA-5655332|Signaling by FGFR3 in disease
R-HSA-1227986|Signaling by ERBB2,R-HSA-1250196|SHC1 events in ERBB2 signaling
R-HSA-1227986|Signaling by ERBB2,R-HSA-1963640|GRB2 events in ERBB2 signaling
R-HSA-1227986|Signaling by ERBB2,R-HSA-1963642|PI3K events in ERBB2 signaling
R-HSA-1227986|Signaling by ERBB2,R-HSA-6785631|ERBB2 Regulates Cell Motility
R-HSA-1227986|Signaling by ERBB2,R-HSA-8847993|ERBB2 Activates PTK6 Signaling
R-HSA-1227986|Signaling by ERBB2,R-HSA-8863795|Downregulation of ERBB2 signaling
R-HSA-1227990|Signaling by ERBB2 in Cancer,R-HSA-9664565|Signaling by ERBB2 KD Mutants
R-HSA-1227990|Signaling by ERBB2 in Cancer,R-HSA-9665686|Signaling by ERBB2 TMD/JMD mutants
R-HSA-1234174|Cellular response to hypoxia,R-HSA-1234158|Regulation of gene expression by Hypoxia-inducible Factor
R-HSA-1234174|Cellular response to hypoxia,R-HSA-1234176|Oxygen-dependent proline hydroxylation of Hypoxia-inducible Factor Alpha
R-HSA-1236394|Signaling by ERBB4,R-HSA-1251985|Nuclear signaling by ERBB4
R-HSA-1236975|Antigen processing-Cross presentation,R-HSA-1236973|Cross-presentation of particulate exogenous antigens (phagosomes)
R-HSA-1236975|Antigen processing-Cross presentation,R-HSA-1236974|ER-Phagosome pathway
R-HSA-1236975|Antigen processing-Cross presentation,R-HSA-1236977|Endosomal/Vacuolar pathway
R-HSA-1236975|Antigen processing-Cross presentation,R-HSA-1236978|Cross-presentation of soluble exogenous antigens (endosomes)
R-HSA-1257604|PIP3 activates AKT signaling,R-HSA-199418|Negative regulation of the PI3K/AKT network
R-HSA-1257604|PIP3 activates AKT signaling,R-HSA-6807070|PTEN Regulation
R-HSA-1280215|Cytokine Signaling in Immune system,R-HSA-449147|Signaling by Interleukins
R-HSA-1280215|Cytokine Signaling in Immune system,R-HSA-5668541|TNFR2 non-canonical NF-kB pathway
R-HSA-1280215|Cytokine Signaling in Immune system,R-HSA-913531|Interferon Signaling
R-HSA-1280215|Cytokine Signaling in Immune system,R-HSA-9607240|FLT3 Signaling
R-HSA-1280215|Cytokine Signaling in Immune system,R-HSA-9674555|Signaling by CSF3 (G-CSF)
R-HSA-1280215|Cytokine Signaling in Immune system,R-HSA-9680350|Signaling by CSF1 (M-CSF) in myeloid cells
R-HSA-1280215|Cytokine Signaling in Immune system,R-HSA-982772|Growth hormone receptor signaling
R-HSA-1280218|Adaptive Immune System,R-HSA-198933|Immunoregulatory interactions between a Lymphoid and a non-Lymphoid cell
R-HSA-1280218|Adaptive Immune System,R-HSA-202403|TCR signaling
R-HSA-1280218|Adaptive Immune System,R-HSA-2132295|MHC class II antigen presentation
R-HSA-1280218|Adaptive Immune System,R-HSA-388841|Regulation of T cell activation by CD28 family
R-HSA-1280218|Adaptive Immune System,R-HSA-983169|Class I MHC mediated antigen processing & presentation
R-HSA-1280218|Adaptive Immune System,R-HSA-983705|Signaling by the B Cell Receptor (BCR)
R-HSA-1296059|G protein gated Potassium channels,R-HSA-1296041|Activation of G protein gated Potassium channels
R-HSA-1296065|Inwardly rectifying K+ channels,R-HSA-1296059|G protein gated Potassium channels
R-HSA-1296071|Potassium Channels,R-HSA-1296065|Inwardly rectifying K+ channels
R-HSA-1296071|Potassium Channels,R-HSA-1296072|Voltage gated Potassium channels
R-HSA-140877|Formation of Fibrin Clot (Clotting Cascade),R-HSA-140837|Intrinsic Pathway of Fibrin Clot Formation
R-HSA-140877|Formation of Fibrin Clot (Clotting Cascade),R-HSA-140875|Common Pathway of Fibrin Clot Formation
R-HSA-141405|Inhibition of the proteolytic activity of APC/C required for the onset of anaphase by mitotic spindle checkpoint components,R-HSA-141430|Inactivation of APC/C via direct inhibition of the APC/C complex
R-HSA-141424|Amplification of signal from the kinetochores,R-HSA-141444|Amplification  of signal from unattached  kinetochores via a MAD2  inhibitory signal
R-HSA-1428517|Aerobic respiration and respiratory electron transport,R-HSA-611105|Respiratory electron transport
R-HSA-1428517|Aerobic respiration and respiratory electron transport,R-HSA-70268|Pyruvate metabolism
R-HSA-1433557|Signaling by SCF-KIT,R-HSA-1433559|Regulation of KIT signaling
R-HSA-1474165|Reproduction,R-HSA-1187000|Fertilization
R-HSA-1474165|Reproduction,R-HSA-1500620|Meiosis
R-HSA-1474228|Degradation of the extracellular matrix,R-HSA-1442490|Collagen degradation
R-HSA-1474228|Degradation of the extracellular matrix,R-HSA-1592389|Activation of Matrix Metalloproteinases
R-HSA-1474244|Extracellular matrix organization,R-HSA-1474228|Degradation of the extracellular matrix
R-HSA-1474244|Extracellular matrix organization,R-HSA-1474290|Collagen formation
R-HSA-1474244|Extracellular matrix organization,R-HSA-1566948|Elastic fibre formation
R-HSA-1474244|Extracellular matrix organization,R-HSA-1566977|Fibronectin matrix formation
R-HSA-1474244|Extracellular matrix organization,R-HSA-216083|Integrin cell surface interactions
R-HSA-1474244|Extracellular matrix organization,R-HSA-3000157|Laminin interactions
R-HSA-1474244|Extracellular matrix organization,R-HSA-3000171|Non-integrin membrane-ECM interactions
R-HSA-1474244|Extracellular matrix organization,R-HSA-3000178|ECM proteoglycans
R-HSA-1474290|Collagen formation,R-HSA-1650814|Collagen biosynthesis and modifying enzymes
R-HSA-1474290|Collagen formation,R-HSA-2022090|Assembly of collagen fibrils and other multimeric structures
R-HSA-1480926|O2/CO2 exchange in erythrocytes,R-HSA-1237044|Erythrocytes take up carbon dioxide and release oxygen
R-HSA-1480926|O2/CO2 exchange in erythrocytes,R-HSA-1247673|Erythrocytes take up oxygen and release carbon dioxide
R-HSA-1483206|Glycerophospholipid biosynthesis,R-HSA-1482788|Acyl chain remodelling of PC
R-HSA-1483206|Glycerophospholipid biosynthesis,R-HSA-1482801|Acyl chain remodelling of PS
R-HSA-1483206|Glycerophospholipid biosynthesis,R-HSA-1482839|Acyl chain remodelling of PE
R-HSA-1483206|Glycerophospholipid biosynthesis,R-HSA-1483115|Hydrolysis of LPC
R-HSA-1483206|Glycerophospholipid biosynthesis,R-HSA-1483166|Synthesis of PA
R-HSA-1483206|Glycerophospholipid biosynthesis,R-HSA-1483191|Synthesis of PC
R-HSA-1483249|Inositol phosphate metabolism,R-HSA-1855204|Synthesis of IP3 and IP4 in the cytosol
R-HSA-1483255|PI Metabolism,R-HSA-1660499|Synthesis of PIPs at the plasma membrane
R-HSA-1483257|Phospholipid metabolism,R-HSA-1483206|Glycerophospholipid biosynthesis
R-HSA-1483257|Phospholipid metabolism,R-HSA-1483255|PI Metabolism
R-HSA-1489509|DAG and IP3 signaling,R-HSA-111997|CaM pathway
R-HSA-1500620|Meiosis,R-HSA-1221632|Meiotic synapsis
R-HSA-1500620|Meiosis,R-HSA-912446|Meiotic recombination
R-HSA-1500931|Cell-Cell communication,R-HSA-373753|Nephrin family interactions
R-HSA-1500931|Cell-Cell communication,R-HSA-391160|Signal regulatory protein family interactions
R-HSA-1500931|Cell-Cell communication,R-HSA-446728|Cell junction organization
R-HSA-1538133|G0 and Early G1,R-HSA-1362277|Transcription of E2F targets under negative control by DREAM complex
R-HSA-1538133|G0 and Early G1,R-HSA-1362300|Transcription of E2F targets under negative control by p107 (RBL1) and p130 (RBL2) in complex with HDAC1
R-HSA-156580|Phase II - Conjugation of compounds,R-HSA-156581|Methylation
R-HSA-156580|Phase II - Conjugation of compounds,R-HSA-156590|Glutathione conjugation
R-HSA-1566948|Elastic fibre formation,R-HSA-2129379|Molecules associated with elastic fibres
R-HSA-156842|Eukaryotic Translation Elongation,R-HSA-156902|Peptide chain elongation
R-HSA-157118|Signaling by NOTCH,R-HSA-1912422|Pre-NOTCH Expression and Processing
R-HSA-157118|Signaling by NOTCH,R-HSA-1980143|Signaling by NOTCH1
R-HSA-157118|Signaling by NOTCH,R-HSA-1980145|Signaling by NOTCH2
R-HSA-157118|Signaling by NOTCH,R-HSA-9012852|Signaling by NOTCH3
R-HSA-157118|Signaling by NOTCH,R-HSA-9013694|Signaling by NOTCH4
R-HSA-157579|Telomere Maintenance,R-HSA-180786|Extension of Telomeres
R-HSA-157858|Gap junction trafficking and regulation,R-HSA-190828|Gap junction trafficking
R-HSA-15869|Metabolism of nucleotides,R-HSA-499943|Interconversion of nucleotide di- and triphosphates
R-HSA-1592230|Mitochondrial biogenesis,R-HSA-2151201|Transcriptional activation of mitochondrial biogenesis
R-HSA-159234|Transport of Mature mRNAs Derived from Intronless Transcripts,R-HSA-159227|Transport of the SLBP independent Mature mRNA
R-HSA-159234|Transport of Mature mRNAs Derived from Intronless Transcripts,R-HSA-159230|Transport of the SLBP Dependant Mature mRNA
R-HSA-159234|Transport of Mature mRNAs Derived from Intronless Transcripts,R-HSA-159231|Transport of Mature mRNA Derived from an Intronless Transcript
R-HSA-162587|HIV Life Cycle,R-HSA-162599|Late Phase of HIV Life Cycle
R-HSA-162599|Late Phase of HIV Life Cycle,R-HSA-165054|Rev-mediated nuclear export of HIV RNA
R-HSA-162599|Late Phase of HIV Life Cycle,R-HSA-167172|Transcription of the HIV genome
R-HSA-162906|HIV Infection,R-HSA-162587|HIV Life Cycle
R-HSA-162906|HIV Infection,R-HSA-162909|Host Interactions of HIV factors
R-HSA-162909|Host Interactions of HIV factors,R-HSA-164952|The role of Nef in HIV-1 replication and disease pathogenesis
R-HSA-162909|Host Interactions of HIV factors,R-HSA-176033|Interactions of Vpr with host cellular proteins
R-HSA-162909|Host Interactions of HIV factors,R-HSA-177243|Interactions of Rev with host cellular proteins
R-HSA-162909|Host Interactions of HIV factors,R-HSA-180534|Vpu mediated degradation of CD4
R-HSA-162909|Host Interactions of HIV factors,R-HSA-180585|Vif-mediated degradation of APOBEC3G
R-HSA-1630316|Glycosaminoglycan metabolism,R-HSA-1638074|Keratan sulfate/keratin metabolism
R-HSA-1630316|Glycosaminoglycan metabolism,R-HSA-1638091|Heparan sulfate/heparin (HS-GAG) metabolism
R-HSA-1630316|Glycosaminoglycan metabolism,R-HSA-1793185|Chondroitin sulfate/dermatan sulfate metabolism
R-HSA-1630316|Glycosaminoglycan metabolism,R-HSA-1971475|Glycosaminoglycan-protein linkage region biosynthesis
R-HSA-1630316|Glycosaminoglycan metabolism,R-HSA-2142845|Hyaluronan metabolism
R-HSA-1632852|Macroautophagy,R-HSA-9663891|Selective autophagy
R-HSA-163359|Glucagon signaling in metabolic regulation,R-HSA-164378|PKA activation in glucagon signalling
R-HSA-163685|Integration of energy metabolism,R-HSA-163359|Glucagon signaling in metabolic regulation
R-HSA-163685|Integration of energy metabolism,R-HSA-422356|Regulation of insulin secretion
R-HSA-1638074|Keratan sulfate/keratin metabolism,R-HSA-2022854|Keratan sulfate biosynthesis
R-HSA-1638091|Heparan sulfate/heparin (HS-GAG) metabolism,R-HSA-2022928|HS-GAG biosynthesis
R-HSA-1638091|Heparan sulfate/heparin (HS-GAG) metabolism,R-HSA-2024096|HS-GAG degradation
R-HSA-1640170|Cell Cycle,R-HSA-1500620|Meiosis
R-HSA-1640170|Cell Cycle,"R-HSA-69278|Cell Cycle, Mitotic"
R-HSA-1640170|Cell Cycle,R-HSA-69620|Cell Cycle Checkpoints
R-HSA-1640170|Cell Cycle,R-HSA-73886|Chromosome Maintenance
R-HSA-1643713|Signaling by EGFR in Cancer,R-HSA-5637812|Signaling by EGFRvIII in Cancer
R-HSA-1643713|Signaling by EGFR in Cancer,R-HSA-5637815|Signaling by Ligand-Responsive EGFR Variants in Cancer
R-HSA-164952|The role of Nef in HIV-1 replication and disease pathogenesis,R-HSA-164938|Nef-mediates down modulation of cell surface receptors by recruiting them to clathrin adapters
R-HSA-1650814|Collagen biosynthesis and modifying enzymes,R-HSA-8948216|Collagen chain trimerization
R-HSA-165159|MTOR signalling,R-HSA-166208|mTORC1-mediated signalling
R-HSA-1655829|Regulation of cholesterol biosynthesis by SREBP (SREBF),R-HSA-2426168|Activation of gene expression by SREBF (SREBP)
R-HSA-166016|Toll Like Receptor 4 (TLR4) Cascade,R-HSA-166058|MyD88:MAL(TIRAP) cascade initiated on plasma membrane
R-HSA-166016|Toll Like Receptor 4 (TLR4) Cascade,R-HSA-166166|MyD88-independent TLR4 cascade 
R-HSA-166058|MyD88:MAL(TIRAP) cascade initiated on plasma membrane,R-HSA-445989|TAK1-dependent IKK and NF-kappa-B activation  
R-HSA-166058|MyD88:MAL(TIRAP) cascade initiated on plasma membrane,R-HSA-450294|MAP kinase activation
R-HSA-1660662|Glycosphingolipid metabolism,R-HSA-9840310|Glycosphingolipid catabolism
R-HSA-166166|MyD88-independent TLR4 cascade ,R-HSA-937061|TRIF (TICAM1)-mediated TLR4 signaling 
R-HSA-166520|Signaling by NTRKs,R-HSA-187037|Signaling by NTRK1 (TRKA)
R-HSA-166520|Signaling by NTRKs,R-HSA-9006115|Signaling by NTRK2 (TRKB)
R-HSA-166658|Complement cascade,R-HSA-166663|Initial triggering of complement
R-HSA-166658|Complement cascade,R-HSA-977606|Regulation of Complement cascade
R-HSA-167172|Transcription of the HIV genome,R-HSA-167161|HIV Transcription Initiation
R-HSA-167172|Transcription of the HIV genome,R-HSA-167162|RNA Polymerase II HIV Promoter Escape
R-HSA-168138|Toll Like Receptor 9 (TLR9) Cascade,R-HSA-975155|MyD88 dependent cascade initiated on endosome
R-HSA-168142|Toll Like Receptor 10 (TLR10) Cascade,R-HSA-975871|MyD88 cascade initiated on plasma membrane
R-HSA-168164|Toll Like Receptor 3 (TLR3) Cascade,R-HSA-445989|TAK1-dependent IKK and NF-kappa-B activation  
R-HSA-168164|Toll Like Receptor 3 (TLR3) Cascade,R-HSA-450294|MAP kinase activation
R-HSA-168164|Toll Like Receptor 3 (TLR3) Cascade,R-HSA-9013973|TICAM1-dependent activation of IRF3/IRF7
R-HSA-168176|Toll Like Receptor 5 (TLR5) Cascade,R-HSA-975871|MyD88 cascade initiated on plasma membrane
R-HSA-168179|Toll Like Receptor TLR1:TLR2 Cascade,R-HSA-166058|MyD88:MAL(TIRAP) cascade initiated on plasma membrane
R-HSA-168181|Toll Like Receptor 7/8 (TLR7/8) Cascade,R-HSA-975155|MyD88 dependent cascade initiated on endosome
R-HSA-168188|Toll Like Receptor TLR6:TLR2 Cascade,R-HSA-166058|MyD88:MAL(TIRAP) cascade initiated on plasma membrane
R-HSA-168255|Influenza Infection,R-HSA-168273|Influenza Viral RNA Transcription and Replication
R-HSA-168255|Influenza Infection,R-HSA-168274|Export of Viral Ribonucleoproteins from Nucleus
R-HSA-168255|Influenza Infection,R-HSA-168276|NS1 Mediated Effects on Host Pathways
R-HSA-168273|Influenza Viral RNA Transcription and Replication,R-HSA-168325|Viral Messenger RNA Synthesis
R-HSA-168273|Influenza Viral RNA Transcription and Replication,R-HSA-192823|Viral mRNA Translation
R-HSA-168274|Export of Viral Ribonucleoproteins from Nucleus,R-HSA-168333|NEP/NS2 Interacts with the Cellular Export Machinery
"R-HSA-168643|Nucleotide-binding domain, leucine rich repeat containing receptor (NLR) signaling pathways",R-HSA-168638|NOD1/2 Signaling Pathway
"R-HSA-168643|Nucleotide-binding domain, leucine rich repeat containing receptor (NLR) signaling pathways",R-HSA-622312|Inflammasomes
R-HSA-168898|Toll-like Receptor Cascades,R-HSA-166016|Toll Like Receptor 4 (TLR4) Cascade
R-HSA-168898|Toll-like Receptor Cascades,R-HSA-1679131|Trafficking and processing of endosomal TLR
R-HSA-168898|Toll-like Receptor Cascades,R-HSA-168138|Toll Like Receptor 9 (TLR9) Cascade
R-HSA-168898|Toll-like Receptor Cascades,R-HSA-168142|Toll Like Receptor 10 (TLR10) Cascade
R-HSA-168898|Toll-like Receptor Cascades,R-HSA-168164|Toll Like Receptor 3 (TLR3) Cascade
R-HSA-168898|Toll-like Receptor Cascades,R-HSA-168176|Toll Like Receptor 5 (TLR5) Cascade
R-HSA-168898|Toll-like Receptor Cascades,R-HSA-168181|Toll Like Receptor 7/8 (TLR7/8) Cascade
R-HSA-168898|Toll-like Receptor Cascades,R-HSA-181438|Toll Like Receptor 2 (TLR2) Cascade
R-HSA-168898|Toll-like Receptor Cascades,R-HSA-5686938|Regulation of TLR by endogenous ligand
R-HSA-168928|DDX58/IFIH1-mediated induction of interferon-alpha/beta,R-HSA-918233|TRAF3-dependent IRF activation pathway
R-HSA-168928|DDX58/IFIH1-mediated induction of interferon-alpha/beta,R-HSA-933541|TRAF6 mediated IRF7 activation
R-HSA-168928|DDX58/IFIH1-mediated induction of interferon-alpha/beta,R-HSA-933542|TRAF6 mediated NF-kB activation
R-HSA-168928|DDX58/IFIH1-mediated induction of interferon-alpha/beta,R-HSA-936440|Negative regulators of DDX58/IFIH1 signaling
R-HSA-169911|Regulation of Apoptosis,R-HSA-211733|Regulation of activated PAK-2p34 by proteasome mediated degradation
R-HSA-170834|Signaling by TGF-beta Receptor Complex,R-HSA-2173789|TGF-beta receptor signaling activates SMADs
R-HSA-170834|Signaling by TGF-beta Receptor Complex,R-HSA-2173793|Transcriptional activity of SMAD2/SMAD3:SMAD4 heterotrimer
R-HSA-174143|APC/C-mediated degradation of cell cycle proteins,R-HSA-174084|Autodegradation of Cdh1 by Cdh1:APC/C
R-HSA-174143|APC/C-mediated degradation of cell cycle proteins,R-HSA-174178|APC/C:Cdh1 mediated degradation of Cdc20 and other APC/C:Cdh1 targeted proteins in late mitosis/early G1
R-HSA-174143|APC/C-mediated degradation of cell cycle proteins,R-HSA-176408|Regulation of APC/C activators between G1/S and early anaphase
R-HSA-174143|APC/C-mediated degradation of cell cycle proteins,R-HSA-176814|Activation of APC/C and APC/C:Cdc20 mediated degradation of mitotic proteins
R-HSA-174414|Processive synthesis on the C-strand of the telomere,R-HSA-174437|Removal of the Flap Intermediate from the C-strand
R-HSA-174417|Telomere C-strand (Lagging Strand) Synthesis,R-HSA-174411|Polymerase switching on the C-strand of the telomere
R-HSA-174417|Telomere C-strand (Lagging Strand) Synthesis,R-HSA-174414|Processive synthesis on the C-strand of the telomere
"R-HSA-174824|Plasma lipoprotein assembly, remodeling, and clearance",R-HSA-8963898|Plasma lipoprotein assembly
"R-HSA-174824|Plasma lipoprotein assembly, remodeling, and clearance",R-HSA-8963899|Plasma lipoprotein remodeling
"R-HSA-174824|Plasma lipoprotein assembly, remodeling, and clearance",R-HSA-8964043|Plasma lipoprotein clearance
R-HSA-176033|Interactions of Vpr with host cellular proteins,R-HSA-180910|Vpr-mediated nuclear import of PICs
R-HSA-176408|Regulation of APC/C activators between G1/S and early anaphase,R-HSA-141405|Inhibition of the proteolytic activity of APC/C required for the onset of anaphase by mitotic spindle checkpoint components
R-HSA-176408|Regulation of APC/C activators between G1/S and early anaphase,R-HSA-174113|SCF-beta-TrCP mediated degradation of Emi1
R-HSA-176408|Regulation of APC/C activators between G1/S and early anaphase,R-HSA-176417|Phosphorylation of Emi1
R-HSA-176409|APC/C:Cdc20 mediated degradation of mitotic proteins,R-HSA-174048|APC/C:Cdc20 mediated degradation of Cyclin B
R-HSA-176409|APC/C:Cdc20 mediated degradation of mitotic proteins,R-HSA-174154|APC/C:Cdc20 mediated degradation of Securin
R-HSA-176409|APC/C:Cdc20 mediated degradation of mitotic proteins,R-HSA-179419|APC:Cdc20 mediated degradation of cell cycle proteins prior to satisfation of the cell cycle checkpoint
R-HSA-176814|Activation of APC/C and APC/C:Cdc20 mediated degradation of mitotic proteins,R-HSA-176409|APC/C:Cdc20 mediated degradation of mitotic proteins
R-HSA-176814|Activation of APC/C and APC/C:Cdc20 mediated degradation of mitotic proteins,R-HSA-176412|Phosphorylation of the APC/C
R-HSA-177243|Interactions of Rev with host cellular proteins,R-HSA-165054|Rev-mediated nuclear export of HIV RNA
R-HSA-177243|Interactions of Rev with host cellular proteins,R-HSA-180746|Nuclear import of Rev protein
R-HSA-177929|Signaling by EGFR,R-HSA-180292|GAB1 signalosome
R-HSA-177929|Signaling by EGFR,R-HSA-182971|EGFR downregulation
R-HSA-1793185|Chondroitin sulfate/dermatan sulfate metabolism,R-HSA-2022870|CS-GAG biosynthesis
R-HSA-1793185|Chondroitin sulfate/dermatan sulfate metabolism,R-HSA-2024101|CS/DS degradation
R-HSA-179419|APC:Cdc20 mediated degradation of cell cycle proteins prior to satisfation of the cell cycle checkpoint,R-HSA-174184|Cdc20:Phospho-APC/C mediated degradation of Cyclin A
R-HSA-179419|APC:Cdc20 mediated degradation of cell cycle proteins prior to satisfation of the cell cycle checkpoint,R-HSA-179409|APC-Cdc20 mediated degradation of Nek2A
R-HSA-180786|Extension of Telomeres,R-HSA-171319|Telomere Extension By Telomerase
R-HSA-180786|Extension of Telomeres,R-HSA-174417|Telomere C-strand (Lagging Strand) Synthesis
R-HSA-181438|Toll Like Receptor 2 (TLR2) Cascade,R-HSA-168179|Toll Like Receptor TLR1:TLR2 Cascade
R-HSA-181438|Toll Like Receptor 2 (TLR2) Cascade,R-HSA-168188|Toll Like Receptor TLR6:TLR2 Cascade
R-HSA-1839124|FGFR1 mutant receptor activation,R-HSA-1839117|Signaling by cytosolic FGFR1 fusion mutants
R-HSA-1852241|Organelle biogenesis and maintenance,R-HSA-1592230|Mitochondrial biogenesis
R-HSA-1852241|Organelle biogenesis and maintenance,R-HSA-5617833|Cilium Assembly
R-HSA-186712|Regulation of beta-cell development,R-HSA-210744|Regulation of gene expression in late stage (branching morphogenesis) pancreatic bud precursor cells
R-HSA-186797|Signaling by PDGF,R-HSA-186763|Downstream signal transduction
R-HSA-187037|Signaling by NTRK1 (TRKA),R-HSA-187687|Signalling to ERKs
R-HSA-187037|Signaling by NTRK1 (TRKA),R-HSA-198203|PI3K/AKT activation
R-HSA-187037|Signaling by NTRK1 (TRKA),R-HSA-198725|Nuclear Events (kinase and transcription factor activation)
R-HSA-187687|Signalling to ERKs,R-HSA-167044|Signalling to RAS
R-HSA-190236|Signaling by FGFR,R-HSA-5654736|Signaling by FGFR1
R-HSA-190236|Signaling by FGFR,R-HSA-5654738|Signaling by FGFR2
R-HSA-190236|Signaling by FGFR,R-HSA-5654741|Signaling by FGFR3
R-HSA-190236|Signaling by FGFR,R-HSA-5654743|Signaling by FGFR4
R-HSA-190828|Gap junction trafficking,R-HSA-190861|Gap junction assembly
R-HSA-190861|Gap junction assembly,R-HSA-190872|Transport of connexons to the plasma membrane
R-HSA-190872|Transport of connexons to the plasma membrane,R-HSA-190840|Microtubule-dependent trafficking of connexons from Golgi to the plasma membrane
R-HSA-1912422|Pre-NOTCH Expression and Processing,R-HSA-1912408|Pre-NOTCH Transcription and Translation
R-HSA-1912422|Pre-NOTCH Expression and Processing,R-HSA-1912420|Pre-NOTCH Processing in Golgi
R-HSA-191273|Cholesterol biosynthesis,R-HSA-9969896|Lanosterol biosynthesis
